"0","scRNA <- RunPCA(scRNA, features = VariableFeatures(scRNA)) "
"2","PC_ 1 
Positive:  FXYD2, SPP1, CRYAB, CLU, FTH1, ANGPTL4, SERPINA1, LDHA, S100A1, KRT19 
	   CXCL14, PDZK1IP1, FGB, GPX3, BIRC3, GAPDH, PLIN2, S100A10, FRZB, CP 
	   PGF, SOD2, AC073218.2, MRPS6, NUPR1, ATP1B1, C1R, HILPDA, VCAM1, CA12 
Negative:  SPARC, SPARCL1, PLVAP, A2M, RAMP2, MGP, ENG, SLC9A3R2, HSPG2, TCF4 
	   SPRY1, ESM1, IFI27, RAMP3, COL4A1, PPAP2A, VWF, COL4A2, ID3, ESAM 
	   FLT1, TMEM204, RNASE1, RBP7, CD93, EPAS1, CD34, BGN, ELTD1, NOTCH4 
PC_ 2 
Positive:  ADIRF, TPM1, GAPDH, VIM, CAV1, LDHA, PGF, CRYAB, FXYD2, ANGPTL4 
	   TIMP1, CLU, C10orf10, S100A1, SPP1, PDZK1IP1, FRZB, S100A10, KRT19, NDUFC1 
	   GPX3, CXCL14, IGFBP7, CALD1, TNFSF10, MT-ND4L, MRPS6, FGB, IGFBP3, CCND1 
Negative:  TYROBP, GPR183, HLA-DPB1, AIF1, FCER1G, HLA-DPA1, RGS1, MS4A6A, HLA-DQA1, HLA-DQB1 
	   HLA-DRA, CTSS, C1QA, C1QB, C1QC, LAPTM5, IL1B, SRGN, LST1, FCGR3A 
	   CCL3, HLA-DRB1, RGS2, HLA-DMB, C1orf162, CPVL, HLA-DMA, PLAUR, APOC1, MS4A7 
PC_ 3 
Positive:  ENPP2, CLDN5, CLEC14A, RNASE1, EFNB2, INHBB, GJA1, RAMP2, RND1, RBP7 
	   DLL4, PALMD, SAT1, PTPRB, S1PR1, GJA5, VEGFC, ELTD1, HEY1, SLC9A3R2 
	   IGFBP3, STC1, ECSCR, ARL15, VWF, CYYR1, CD93, RAMP3, PLVAP, SEMA3G 
Negative:  TPM2, TAGLN, COL1A2, ACTA2, RGS5, COX4I2, TPPP3, THY1, PLAC9, MYL9 
	   HIGD1B, BGN, PLN, MFGE8, LHFP, OLFML2B, PPP1R14A, ITM2C, NOTCH3, PDGFRB 
	   CRISPLD2, SEPT4, CD36, MYLK, COL6A2, COL1A1, COL3A1, FMO3, KCNJ8, MYH11 
PC_ 4 
Positive:  BIRC5, UBE2C, TOP2A, CENPF, MKI67, PTTG1, TPX2, CDC20, KIAA0101, CDK1 
	   NUSAP1, ASPM, HMMR, GTSE1, CDKN3, CENPA, CDCA3, CCNB2, STMN1, FAM64A 
	   PLK1, TK1, ZWINT, CCNB1, TUBA1B, UBE2T, PRC1, RRM2, AURKA, CCNA2 
Negative:  MZB1, PTPRCAP, CD52, IGJ, GZMA, NKG7, IGLL5, CD3D, CD27, CD2 
	   CCL5, KLRB1, CD79A, CD3E, GZMK, IL2RG, DERL3, TNFRSF17, ITM2C, CST7 
	   CD69, PIM2, IL7R, CTSW, JSRP1, CD7, FKBP11, LTB, FCRL5, HOPX 
PC_ 5 
Positive:  BIRC5, UBE2C, TOP2A, CENPF, PTTG1, MKI67, CDC20, CDKN3, TPX2, CDK1 
	   HMMR, CENPA, ASPM, CCNB2, FAM64A, CDCA3, PLK1, GTSE1, CD52, NUSAP1 
	   PTPRCAP, CCL5, CCNB1, CD3D, UBE2T, GZMA, KIAA0101, AURKA, NKG7, PRC1 
Negative:  FTL, CST3, SOD2, GPX3, SERPINA1, PDZK1IP1, GPX1, MT-ND1, MT-ND3, CD68 
	   C1QA, FTH1, C1QB, C1QC, SAT1, KRT19, C3, GADD45B, KRT18, CXCL14 
	   MT-ND5, IER3, ADIRF, S100A1, MT-CYB, CTSD, PDK4, TPM1, CLU, CD74 
"
"0","ElbowPlot(scRNA, ndims=30, reduction=""pca"") "
